{"$schema":"https://json-schema.org/draft/2020-12/schema","title":"Kiln Handoff","type":"object","required":["stage","task","inputs","outputs","changed_files","checks","evidence","open_failures","next_action"],"properties":{"stage":{"type":"string"},"task":{"type":"string"},"inputs":{"type":"array","items":{"type":"string"}},"outputs":{"type":"array","items":{"type":"string"}},"changed_files":{"type":"array","items":{"type":"string"}},"checks":{"type":"array","items":{"type":"string"}},"evidence":{"type":"array","items":{"type":"string"}},"open_failures":{"type":"array","items":{"type":"string"}},"next_action":{"type":"string"}},"additionalProperties":false}