{
  "stage": "modeler",
  "task": "Derive correctness guarantees from the supplied requirements.",
  "inputs": ["factory/artifacts/tablekeeper-plan.md"],
  "outputs": ["factory/schemas/invariants.tablekeeper.json"],
  "changed_files": ["factory/schemas/invariants.tablekeeper.json"],
  "checks": ["schema validation"],
  "evidence": ["INV-001 through INV-004 are declared"],
  "open_failures": [],
  "next_action": "Builder implements the approved model."
}